id,name,category,expertise,tags,address/street/0,address/neighborhood,address/city,address/phone,description,operation,price_avg,payment_methods/credit_card/0,payment_methods/credit_card/1,payment_methods/credit_card/2,payment_methods/credit_card/3,payment_methods/debit_card/0,payment_methods/debit_card/1,payment_methods/debit_card/2,services/0,services/1,services/2,location/lat,location/lng,payment_methods/credit_card/4,services/3,services/4,services/5,payment_methods/debit_card/3,doperation,services/6,address/price_avg,services/7,payment_methods/street/0,payment_methods/street/1,payment_methods/street/2,payment_methods/street/3,payment_methods/street/4,services/8,services/9,debit_card/0,debit_card/1,debit_card/2,debit_card/3,debit_card/4,descriptin,details,rating,vote_count,,,,
0,Caricatura do Chicão,Bares,Botecos,PE,"Rua João da Silva Teles, 121",Parnamirim,Recife,(81) 3267-5080,"Tanto no endereço da Zona Sul como no Parnamirim, os clientes podem pedir o camarão ao alho e óleo (R$ 18,90, 300 gramas) e o filezinho aos quatro queijos servido com batata frita (R$ 38,90, para quatro pessoas). Para os frequentadores da unidade da Zona Norte, ainda há o pão de alho (R$ 7,90), petisco que tem bastante saída na unidade do local. Ali, também é possível encontrar cervejas Brahma e Antártica por R$ 4,99 a garrafa com 600 mililitros, em qualquer dia da semana. A caipirinha de morango com vodca Orloff custa R$ 10,90 em ambas as casas. Os preços e demais informações foram apurados entre os meses de abril e junho de 2015.",11h/0h (sex. e sáb. até 2h,"Preço até R$ 50,00",American Express,Dinners,Hipercard,Mastercard,Maestro,Rede Shop,Visa Electron,Acesso para deficientes,Ar condicionado,Levar vinhos (permite),-80335135,-349143999,Visa,Lugares/Capacidade (total 180),Vinho em taça,,,,,,,,,,,,,,,,,,,,,1.29,185,,,,
0,Bodega do Futuro,Bares,Botecos,PE,"Rua do Futuro, 181",Graças,Recife,3125-1181,"Telas do pernambucano Romero Pontes, com retratos de músicos como Amy Winehouse, Elvis Presley e Bob Marley, enfeitam as paredes do bar. Novidade do cardápio, o trio ternura reúne bolinho de queijo empanado, charque desfiada e azeitona (R$ 17,00) e disputa atenção com o petisco mais pedido da casa: a costelinha suína ao molho barbecue mais batata frita (R$ 29,00). Os pedidos vão bem com cerveja Heineken (R$ 9,50, 600 mililitros) e caipifruta de kiwi com vodca Smirnoff (R$ 12,00) ou Absolut (R$ 15,00). De terça a domingo, DJs e bandas locais animam a moçada com um repertório que passeia pelo pop rock, reggae e surf music. Os preços e demais informações foram apurados entre os meses de abril e junho de 2015.",19h/2h (fecha seg.),Sem cotação,Mastercard,Visa,,,Maestro,Visa Electron,,Acesso para deficientes,Acesso wireless,Ar condicionado,-80427615,-349008255,,,,,,,,,,,,,,,,,,,,,,,,2.94,23,,,,
0,Confraria dos Chifrudos,Bares,Botecos,PE,"Rua Real da Torre, s/nº - Mercado da Madalena, box 10",Madalena,Recife,(81) 3236-2817,"A bem-humorada decoração diverte a clientela deste bar, um dos mais concorridos do Mercado da Madalena. Chifres de boi e um sino enfeitam as paredes e uma placa, logo na entrada, avisa: ""Quem não for corno seja bem-vindo. Quem for, toque o sino"". Para petiscar, a cozinha prepara bode guisado (R$ 20,00) e cupim acebolado (R$ 12,00), ambos escoltados por macaxeira ou cuscuz, em porção para duas pessoas. As cervejas Brahma e Itaipava, em garrafas de 600 mililitros, saem a R$ 6,00 cada uma. Os preços e demais informações foram apurados entre os meses de abril e junho de 2015.",5h30/17h (dom. e feriados até 13h, fecha seg.),Sem cotação,,,,,,,,,,,-80475405,-348791508,,,,,,,,,,,,,,,,,,,,,,,,1.44,3,,,
0,Loft. Casa Forte,Bares,Drinques,PE,"Praça de Casa Forte, 661",Casa Forte,Recife,3268-0033,"O barman Jonathan Macena se esmera na hora de preparar um drinque exclusivo a partir da base de bebidas escolhida pelos clientes. Gim, vodca, uísque, rum ou tequila costumam integrar esses coqueteis, que custam R$ 22,00 cada um. Da carta já existente, ganham a preferência do público o lost citrus, feito com vodca, hortelã, refrigerante cítrico e xarope de curaçao blue (R$ 17,00). No cardápio figuram a porção de tiras de filé-mignon com molho de queijo, que vem à mesa na companhia de pão italiano (R$ 36,00, para duas pessoas) e o pastel recheado de queijo suíço e servido com geleia de pimenta e damasco (R$ 21,00, oito unidades). Às quartas, quintas e aos domingos, há música ao vivo com bandas de pop rock para animar as noitadas. Os preços e demais informações foram apurados entre os meses de abril e junho de 2015.",19h/2h (fecha seg. e ter.),Sem cotação,American Express,Dinners,Hipercard,Mastercard,Maestro,Rede Shop,Visa Electron,Acesso wireless,Ar condicionado,Valet/Manobrista,-80363107,-349219877,Visa,,,,,,,,,,,,,,,,,,,,,,,2.52,135,,,,
0,Botequim Avenida,Bares,Happy hour,PE,"Avenida Boa Viagem, 7074",Boa Viagem,Recife,32048852,"As noites de quinta-feira são animadas pela Samba da Gente. Às sextas e aos sábados, Júnior Max se encarrega de tocar forró e sertanejo. Aos domingos, o repeteco de sertanejo acontece das 17h às 22h. Os clientes também podem se divertir com a mesa de sinuca (R$ 25,00 a hora). Para beliscar, o camarão na cerveja empanado (R$ 36,90) satisfaz três pessoas, e costuma ser pedido junto das cervejas Devassa (R$ 6,90, 600 mililitros) ou Baden Baden (R$ 21,90, 600 mililitros). Entre os drinques, o clássico manhattan custa R$ 12,10. Os preços e demais informações foram apurados entre os meses de abril e junho de 2015.",17h/1h (sex. até 2h, sáb. 12h/2h, dom. 12h/22h, fecha seg.),Sem cotação,Hipercard,Mastercard,Visa,,Maestro,Visa Electron,,Acesso para deficientes,Acesso wireless,Atividades para crianças,-81511295,-349104041,,,,,,,,,,,,,,,,,,,,,,,,4.28,269,
0,Farol Restaurante,Bares,Botecos,PE,"Travessa Dantas Barreto, 76 B",Carmo,Olinda,3203-2187,"Neste endereço de Olinda, os frequentadores contemplam a paisagem à beira-mar petiscando porções como macaxeira gratinada com charque (R$ 29,50, para duas pessoas) e camarão ao alho e óleo (R$ 39,00, 500 gramas). Os pedidos vão bem com cerveja Skol (R$ 9,00, 600 mililitros) ou com a caipirinha de saquê, preparada com morango, kiwi ou uva (R$ 14,00). Se a intenção for almoçar ou jantar, tem boa saída o grelhado de frutos do mar, que reúne camarão, polvo, lula, mexilhão, peixe e salmão preparados na chapa e guarnecidos de arroz branco (R$ 110,00, para três pessoas). Os preços e demais informações foram apurados entre os meses de abril e junho de 2015.",12h/0h (sex. e sáb. até 1h, dom. 11h/21h),Sem cotação,American Express,Dinners,Mastercard,Visa,Maestro,Rede Shop,Visa Electron,Acesso wireless,,,-8012406,-348515474,,,,,,,,,,,,,,,,,,,,,,,,1.73,208,,,
0,Mercado da Boa Vista,Bares,Botecos,PE,"Rua Santa Cruz, s/nº",Boa Vista,Recife,(81) 3421-9192,"A culinária regional predomina nos nove bares instalados no mercado, frequentado sobretudo pelo público jovem. Petisco comum a todos, o sarapatel com farinha de mandioca custa R$ 15,00 e serve duas pessoas. Já no Neto's Bar, a porção de maior saída é a de carne de sol com batata frita e queijo de coalho (R$ 30,00, para quatro pessoas). Novidade no cardápio do Buchada's Bar, o arrumadinho vegetariano leva queijos manteiga, de coalho e ricota (R$ 15,00, para dois), e pode fazer parceria com as cachaças Seleta ou Boazinha (R$ 5,00 cada uma). Vendidas em garrafa, as cervejas Bohemia, Original (R$ 8,00 cada uma) e Skol (R$ 7,00) são as bebidas mais requisitadas em todos os boxes. Aos sábados e domingos, grupos musicais variados fazem shows na área ao ar livre. Os preços e demais informações foram apurados entre os meses de abril e junho de 2015.",7h/19h (dom. até 16h),Sem cotação,Visa,,,,Visa Electron,,,Acesso wireless,,,-80631761,-348907612,,,,,,,,,,,,,,,,,,,,,,,,4.92,157,,,,
0,Empório Marítimo,Bares,Música ao vivo,PE,"Avenida Beira-Rio, 887",Torre,Recife,(81) 3226-3127,"O ritmo predominante na casa é MPB, cantada em voz e violão pelo mesmo cantor há doze anos. O Rio Capibaribe é o cenário de quem se acomoda às mesas, nas quais chegam petiscos feitos com frutos do mar, como a isca de peixe ao molho rosé (R$ 32,90, para até três pessoas) ou o polvo cozido com vinagrete (R$ 49,90), em porção suficiente para até três pessoas. Gratinado com purê de jerimum e servido com arroz, o camarão beira rio sai por R$ 49,90 e satisfaz dois comensais. A carta de bebidas reúne cerveja Original (R$ 9,50 a garrafa) e a caipirosca de kiwi (R$ 7,00). Os preços e demais informações foram apurados entre os meses de abril e junho de 2015.",17h/1h (sex. e sáb. 11h/2h, dom. 11h/21h, fecha seg.),Sem cotação,American Express,Dinners,Hipercard,Mastercard,Maestro,Rede Shop,Visa Electron,Acesso para deficientes,Acesso wireless,,-80460987,-349066237,Visa,,,,,,,,,,,,,,,,,,,,,,,3.08,179,,
0,Nosso Jeito Bar,Bares,Para dançar,PE,"Rua Bispo Cardoso Ayres, 65",Boa Vista,Recife,3221-8337,"As músicas executadas por duas bandas à noite transitam entre MPB, axé e frevo. Durante os intervalos, uma DJ residente comanda as picapes. Aos domingos, recebe uma entusiasmada roda de samba. Em todas as ocasiões, a cerveja Skol (R$ 6,00 o latão) e a clássica caipirinha (R$ 5,00) ajudam o público a manter o ritmo. Caldinhos de marisco, camarão, dobradinha ou caldo verde (R$ 4,00 cada um) forram o estômago da clientela. Os preços e demais informações foram apurados entre os meses de abril e junho de 2015.",22h/5h (dom. 14h/23h, fecha seg. a sex.),Sem cotação,American Express,Dinners,Hipercard,Mastercard,Maestro,Rede Shop,Visa Electron,Acesso para deficientes,Acesso wireless,Ar condicionado,-80571531,-348889643,Visa,,,,,,,,,,,,,,,,,,,,,,,2.57,297,,,
0,Papacapim,Restaurantes,Variados/bufê,PE,"Avenida Rui Barbosa, 1397",Graças,Recife,(81) 3427-0010,"Com a reforma recente, o salão principal da unidade das Graças passou a ser climatizado. Outra novidade é o maior número de pratos que compõem o bufê. Agora, são cerca de cinquenta receitas quentes e trinta tipos de salada. O carpaccio de melancia e o filé-mignon ao francês, feito com creme de leite fresco, presunto, vinho branco, manteiga e batata palha, costumam aparecer com frequência. Nas Graças, o bufê custa R$ 31,90 por pessoa, enquanto em Boa Viagem os clientes pagam R$ 30,90. Nos fins de semana e feriados, os dois endereços cobram R$ 35,90 por pessoa. Crianças até oito anos pagam R$ 16,90. No cardápio à la carte, figuram saladas, crepes, pizzas e doces. A redonda de mussarela, alho-poró, mascarpone e shimeji custa R$ 57,30, com oito fatias. Os preços e demais informações foram apurados entre os meses de abril e junho de 2015.",11h30/15h e 17h30/23h30 (sex. e sáb. jantar até 0h30),"Preço até R$ 50,00",American Express,Dinners,Hipercard,Mastercard,Maestro,Rede Shop,Visa Electron,Acesso para deficientes,Acesso wireless,Atividades para crianças,-80801988,-349348843,Visa,Estacionamento,Levar vinhos (permite),Lugares/Capacidade (total 320),,,Vinho em taça SITE OFICIAL,,,,,,,,,,,,,,,,,4.26,4,,,,
0,Munganga Bistrô,Restaurantes,Peixes e frutos do mar,PE,"Rua das Piscinas Naturais, 32 - Galeria Caminho da Praia",Porto de Galinhas,Ipojuca,(81) 3552-2480,"Anéis de lula empanados em massa com cerveja, servidos com molho rosé ao conhaque (R$ 34,90, para duas pessoas), vão bem entre goles de caipirosca de uva e vodca Absolut (R$ 18,50). No camarão ao coco verde, o crustáceo grelhado, servido dentro da fruta, leva molho cremoso de coco com uva e maçã verde (R$ 59,90). Na hora da sobremesa, tem fãs a tapioca munganga, recheada com sorvete de coco, coberta com coulis de frutas vermelhas ao vinho do Porto (R$ 19,90). Os preços e demais informações foram apurados entre os meses de abril e junho de 2015.",9h/0h,"Preço de R$ 76,00 a R$ 100,00",Mastercard,Visa,,,Maestro,Rede Shop,Visa Electron,Acesso para deficientes,Acesso wireless,Ar condicionado,-8507279,-350026536,,Levar vinhos (permite),Lugares/Capacidade (total 100),Vinho em taça,,,,,,,,,,,,,,,,,,,,1.24,223,,,,
0,Edmilson da Carne-de-Sol,Restaurantes,Carnes,PE,"Avenida Alberto Santos Dumont, 311",Jordão,Recife,(81) 3463-6712,"Em funcionamento há 41 anos, a casa tem como hit o filé com 300 gramas de carne de sol, assado na brasa com alho ou cebola-roxa, acompanhado de feijão-tropeiro, arroz, purê de macaxeira, batata e macaxeira fritas, farofa de jerimum, salada e manteiga de garrafa (R$ 29,90). Para duas pessoas, o charque é guarnecido de feijão-verde, arroz, macaxeira, vinagrete e farofa (R$ 54,90). No final, ninguém dispensa a cartola (R$ 19,90). Os preços e demais informações foram apurados entre os meses de abril e junho de 2015.",11h/18h,"Preço até R$ 50,00",,,,,,,,Estacionamento,Lugares/Capacidade (total 300),Vinho em taça,-81411341,-349229006,,,,,,,,,,,,,,,,,,,,,,,,2.58,176,,,,
0,Chez Brigitte,Restaurantes,Franceses,PE,"Rua Esmeraldino Bandeira, 106",Graças,Recife,3221-4151,"Como sugestão de entrada, a belga Brigitte Anckaert prepara fundo de alcachofra com suflê de espinafre, cogumelo-de-paris e frutos do mar (R$ 42,00). Do rol dos principais, o magret de pato ao molho de jabuticaba pode ser guarnecido de arroz de castanha ou purê de batata-doce (R$ 59,00). O camarão com gengibre e coentro ao molho de ostra, com arroz perfumado (R$ 63,00), harmoniza com o branco chileno Casas Del Toqui Sauvignon Blanc (R$ 58,00). Para finalizar, tem creme brûlé a R$ 23,00. Os preços e demais informações foram apurados entre os meses de abril e junho de 2015.",19h/0h (dom. só almoço 12h/16h, fecha seg.),"Preço de R$ 76,00 a R$ 100,00",American Express,Dinners,Mastercard,Visa,Maestro,Rede Shop,Visa Electron,Acesso para deficientes,Acesso wireless,Ar condicionado,-80467256,-349014897,,Estacionamento,Levar vinhos (permite),Lugares/Capacidade (total 55),,,Valet/Manobrista,,Vinho em taça,,,,,,,,,,,,,,,3.41,74,,,
0,Evoke,Restaurantes,Peixes e frutos do mar,PE,"Rua das Piscinas Naturais, s/nº",Porto de Galinhas,Ipojuca,3552-1391 e 98643-1035,"Para abrir o apetite, a bruschetta de tomate e manjericão (R$ 14,90) pede a companhia do vinho tinto português Quinta do Crasto Vinhas Velhas (R$ 91,90). Bastante requisitada, a lagosta trinchada ao creme de champanhe recebe risoto de caju como guarnição (R$ 58,00). Na hora da sobremesa, não há concorrência para os sorvetes artesanais de coco, baunilha ou chocolate maltado - a taça com uma bola custa R$ 6,90. Os preços e demais informações foram apurados entre os meses de abril e junho de 2015.",12h/22h (qui. a sáb. até 0h, fecha ter.),"Preço de R$ 51,00 a R$ 75,00",American Express,Dinners,Hipercard,Mastercard,Maestro,Rede Shop,Visa Electron,Acesso para deficientes,Acesso wireless,Ar condicionado,-83981037,-350613227,Visa,Levar vinhos (permite),Lugares/Capacidade (total 120),Vinho em taça,,,,,,,,,,,,,,,,,,,,1.43,47,,,
0,Mamulengo,Restaurantes,Variados/bufê,PE,"Rua Minas Gerais, 56",Ilha do Leite,Recife,(81) 3423-0556,"Bonecos de pano e tecido de chita compõem a decoração da casa. O bufê, montado na hora do almoço, inclui o frango à michelangelo, preparado com peito da ave ao molho de tomate e manjericão, o linguine ao pesto e o risoto de bacalhau. Custa R$ 54,90 o quilo. Pelo mesmo valor, passam na balança diariamente dez tipos de sobremesas, entre elas a torta de tâmara com castanha. O suco de tangerina acompanha a refeição por R$ 3,80. Os preços e demais informações foram apurados entre os meses de abril e junho de 2015.",11h30/14h30 (fecha sáb. e dom.),"Preço até R$ 50,00",American Express,Dinners,Hipercard,Mastercard,Maestro,Rede Shop,Visa Electron,Ar condicionado,Estacionamento,Lugares/Capacidade (total 90),-80644992,-348955952,Visa,,,,,,,,,,,,,,,,,,,,,,,3.33,273,,,,
0,Dalí Cocina,Restaurantes,Variados,PE,"Rua Feliciano Gomes, 172",Derby,Recife,3231-4759,"Da cozinha de inspiração mediterrânea saem pratos como o risoto de camarão com queijo emmental e tomate seco (R$ 49,00) e o salmão em crosta de gergelim ao molho de manga, servido com arroz à provençal (R$ 42,00). Cubos de filé-mignon ao molho madeira, com queijo gratinado, alho-poró e torradas (R$ 32,00), abrem o apetite ao lado do vinho tinto argentino Vista Calma Malbec (R$ 63,00). Hit da ala doce, o brigadeiro de cachaça envelhecida vai à mesa com sorvete de creme (R$ 17,00). Os preços e demais informações foram apurados entre os meses de abril e junho de 2015.",11h/15h30 (qui. também 19h/23h, sex. e sáb. também 19h/0h, dom. até 16h, fecha seg.),"Preço de R$ 51,00 a R$ 75,00",American Express,Dinners,Hipercard,Mastercard,Maestro,Rede Shop,Visa Electron,Acesso para deficientes,Acesso wireless,Ar condicionado,-80553648,-349012416,Visa,Estacionamento,Levar vinhos (permite),Lugares/Capacidade (total 55),,,Vinho em taça,,,,,,,,,,,,,,,,,4.45,21,
0,Zen,Restaurantes,Japoneses,PE,"Rua da Hora, 288",Espinheiro,Recife,(81) 3204-3000,"Tem fãs o rodízio com mais de 100 itens, entre saladas, sushis, sashimis, temakis e pratos quentes. Cubos de salmão maçaricados com geleia de damasco e gergelim, penne com filé-mignon, camarão ao molho de cogumelos-de-paris, tempurá de camarão e doce de goiaba empanado com cream cheese circulam pelo salão. No almoço de segunda a sexta, a comilança custa R$ 36,90 (Espinheiro) e R$ 38,90 (Piedade). Nos demais horários, os preços sobem para R$ 42,90 e R$ 46,90, respectivamente. Os preços e demais informações foram apurados entre os meses de abril e junho de 2015.","11h30/15h e 18h/23h30 (sex., jantar até 0h; sáb., almoço até 16h e jantar até 0h; dom. e feriados sem intervalo)","Preço de R$ 51,00 a R$ 75,00",American Express,Dinners,Hipercard,Mastercard,Maestro,Rede Shop,Visa Electron,Ar condicionado,Levar vinhos (permite),Lugares/Capacidade (total 230 lugares),-80440217,-348951262,Visa,Valet/Manobrista,Vinho em taça,,,,,,,,,,,,,,,,,,,,,4.45,148,,,,
0,Cidade 32,Restaurantes,Variados,PE,"Praça João Alfredo, 32",Amparo,Olinda,99859-1001 e 99561-3082,"Misto de galeria de arte e restaurante, o casarão é comandado pelos italianos Cláudio Vitalli e Marco Monaldi. Eles preparam receitas de influência mediterrânea, como o filé de salmão com manjericão fresco, servido com purê de batata e ervas (R$ 34,00). O ceviche de sirigado e camarão cumpre a função de entrada (R$ 28,00). Na carta de vinhos, o tinto italiano Chianti Laronchi custa R$ 70,00. Para a sobremesa, a sugestão é o crepe de manga com calda da fruta, sorvete de creme e redução de balsâmico (R$ 12,00). Os preços e demais informações foram apurados entre os meses de abril e junho de 2015.",11h30/15h30 e 18h30/0h (qui. só jantar, fecha seg. a qua.),"Preço de R$ 76,00 a R$ 100,00",,,,,,,,Acesso wireless,Lugares/Capacidade (total 40),Vinho em taça,-80167062,-348529383,,,,,,,,,,,,,,,,,,,,,,,,4.87,258,,,
0,Robata Sushi Wadamon,Restaurantes,Japoneses,PE,"Rua Oliveira Goes, 250",Poço da Panela,Recife,3033-3301,"Depois de recepcionar a clientela, o sushiman Wadamon prepara os pedidos. O ussuzukuri, sashimi de salmão ou cioba de corte bem fino (R$ 54,80, para duas pessoas), concorre com o kishumaki, sushi de lula (R$ 48,89, oito peças), e o tempurá de camarão (R$ 76,89, para duas pessoas). Escolta a refeição a cerveja japonesa Kirin long neck (R$ 7,90). Para finalizar, entra em cena o tempurá de sorvete (R$ 17,80). Os preços e demais informações foram apurados entre os meses de abril e junho de 2015.",12h/15h e 18h/23h (fecha qua.),"Preço de R$ 51,00 a R$ 75,00",American Express,Dinners,Mastercard,Visa,Maestro,Visa Electron,,Acesso wireless,Ar condicionado,Lugares/Capacidade (total 80),-80385183,-349225178,,,,,,,,,,,,,,,,,,,,,,,,2.49,126,,,,
0,Burgogui,Restaurantes,Coreano,PE,"Rua Venezuela, 153",Espinheiro,Recife,(81) 3423-0692,"À frente da cozinha está a coreana Soon Ja Choi, há quatro décadas radicada em Recife. O burgogui, churrasco coreano servido na chapa, aparece nas versões de cioba (R$ 69,00), shiitake, lula ou camarão (R$ 82,00 cada um). A caldeirada de camarão, lula, mexilhão, tofu, polvo, cioba e macarrão de batata sai por R$ 89,00 - todos os pratos dão para quatro pessoas e acompanham missoshiru, arroz, legumes refogados, batata caramelada, broto de feijão, pasta de soja e kimchi (conserva à base de acelga). A aguardente coreana Soju (R$ 9,70 a dose) escolta a refeição. Os preços e demais informações foram apurados entre os meses de abril e junho de 2015.",12h/15h e 18h/23h (fecha seg.),"Preço até R$ 50,00",American Express,Dinners,Hipercard,Mastercard,Maestro,Rede Shop,Visa Electron,Ar condicionado,Estacionamento,Lugares/Capacidade (total 60),-80475509,-348959392,Visa,,,,,,,,,,,,,,,,,,,,,,,4.26,248,,,,
0,Adega,Restaurantes,Portugueses,PE,"Avenida Conselheiro Rosa e Silva, 172 - Clube Português",Graças,Recife,(81) 3221-6258,"Estrela do menu, o bacalhau aparece em vinte receitas. Na versão chafarix, a posta alta grelhada vai à mesa com cebola, alho, camarão puxado no azeite, batata, pimentões coloridos e azeitona preta (R$ 88,90, para duas pessoas). O prato harmoniza com o vinho branco alentejano Esporão Monte Velho (R$ 66,00). Da cozinha também saem pratos de outras influências, caso do camarão adega, puxado na manteiga com molho de mostarda e vinagre balsâmico, acompanhado de arroz à piamontese (R$ 48,90), e da sobremesa cartola (R$ 11,50). Os preços e demais informações foram apurados entre os meses de abril e junho de 2015.",11h30/16h (qua. a sex. também jantar 18h30/23h),"R$ 51,00 a R$ 75,00",Dinners,Hipercard,Mastercard,Visa,Maestro,Rede Shop,Visa Electron,Acesso para deficientes,Acesso wireless,Ar condicionado,-80499677,-348982473,,Atividades para crianças,Estacionamento,Levar vinhos (permite),,,Lugares/Capacidade (total 130),,Vinho em taça,,,,,,,,,,,,,,,1.03,58,,,,
0,Florença,Restaurantes,Carnes,PE,"Rua Capitão Aurélio de Araújo, 135",Iputinga,Recife,3032-2987,"Camarões empanados com molho rosé (R$ 29,90) abrem o apetite para a peixada brasileira com legumes, pirão de peixe e arroz (R$ 59,90, para duas pessoas). Coberta com queijo de coalho, a carne de sol, com 800 gramas, vai à mesa na companhia de feijão-macáçar, arroz, pirão de queijo, paçoca, macaxeira frita, farofa e vinagrete (R$ 63,90, para quatro pessoas). No jantar, o cliente escolhe uma das 29 pizzas. A sertaneja, de frango, bacon, cogumelo-de-paris e catupiry, custa R$ 33,90. O petit gâteau com sorvete de creme (R$ 14,90) põe o ponto final. Os preços e demais informações foram apurados entre os meses de abril e junho de 2015.",11h/0h,"até R$ 50,00",American Express,Dinners,Hipercard,Mastercard,Maestro,Rede Shop,Visa Electron,Acesso wireless,Ar condicionado,Atividades para crianças,-80407814,-349337936,Visa,Lugares/Capacidade (total 200),Valet/Manobrista,Vinho em taça,,,,,,,,,,,,,,,,,,,,2.3,287,,,,
0,Entre Amigos,Restaurantes,Variados,PE,"Rua Marquês de Valença, 30",Boa Viagem,Recife,(81) 3312-1000,"Quinze receitas à base de carne de bode fazem a fama da casa. Um dos campeões de pedidos é o filé de costela de bode assado, servido com feijão-verde, arroz e macaxeira cozida (R$ 78,00, para duas pessoas). Quem preferir outro tema pode optar pelo bacalhau à gomes de sá (R$ 89,95, para três) na companhia de caipifruta frozen de cajá (R$ 11,50). Na unidade de Boa Viagem, tem rodízio de sushi (R$ 49,90 por pessoa), de domingo a quinta, a partir das 18h. Mesmo preço é cobrado pelo bufê de feijoada, montado aos sábados no almoço. Os preços e demais informações foram apurados entre os meses de abril e junho de 2015.",11h30/1h (sáb. e dom. até 2h),"R$ 51,00 a R$ 75,00",American Express,Dinners,Mastercard,Visa,Maestro,Rede Shop,Visa Electron,Acesso para deficientes,Acesso wireless,Ar condicionado,-81289557,-349052807,,Atividades para crianças,Estacionamento,Lugares/Capacidade (total 800),,,Valet/Manobrista,,Vinho em taça,,,,,,,,,,,,,,,3.84,291,,,,
0,Charque do Alemão,Restaurantes,Cozinha regional,PE,"Avenida do Forte, 233",Cordeiro,Recife,(81) 3445-5718,"Logo na chegada, a clientela pede caldinho de mocotó (R$ 4,00) para abrir o apetite na companhia da cerveja Skol (R$ 6,00). Para três pessoas, a picanha suína vem com arroz, feijão-macáçar, maionese de batata, farofa, vinagrete e macaxeira cozida (R$ 36,00). Mesmas guarnições recebe a galinha à cabidela (R$ 24,90, para três pessoas). Já o cupim na brasa vai à mesa com queijo de coalho, arroz, macaxeira frita, feijão-macáçar, farofa e vinagrete (R$ 39,00). Os preços e demais informações foram apurados entre os meses de abril e junho de 2015.",11h/0h,"R$ 50,00",American Express,Dinners,Hipercard,Mastercard,Maestro,Rede Shop,Visa Electron,Acesso wireless,Estacionamento,Lugares/Capacidade (total 400),-80497707,-349269641,Visa,,,,,,,,,,,,,,,,,,,,,,,1.85,274,,,,
