id,name,category,expertise,tags,address/street/0,address/neighborhood,address/city,address/phone,description,operation,price_avg,payment_methods/credit_card/0,payment_methods/credit_card/1,payment_methods/credit_card/2,payment_methods/credit_card/3,payment_methods/debit_card/0,payment_methods/debit_card/1,payment_methods/debit_card/2,services/0,services/1,services/2,location/lat,location/lng,payment_methods/credit_card/4,services/3,services/4,services/5,payment_methods/debit_card/3,doperation,services/6,address/price_avg,services/7,payment_methods/street/0,payment_methods/street/1,payment_methods/street/2,payment_methods/street/3,payment_methods/street/4,services/8,services/9,debit_card/0,debit_card/1,debit_card/2,debit_card/3,debit_card/4,descriptin,details,rating,vote_count,,,,
0,Taberna Japonesa Quina do Futuro,Restaurantes,Japoneses,PE,"Rua Xavier Marques, 134",Aflitos,Recife,(81) 3241-9589,"Nada mais condizente com o título de chef do ano do que alçar seu restaurante ao topo da categoria. Amparado por gente de sua inteira confiança, como a mãe e a mulher, André Saburó Matsumoto mantém um pé na tradição e outro na vanguarda e, assim, faz o Quina do Futuro acontecer. Ele e mais quatro sushimen são os responsáveis por esculpir deliciosos bolinhos de arroz, sobre os quais são depositados peixes e frutos do mar lapidados por uma faca afiada. Quem senta ao balcão ou ao lado dos grandes aquários que enfeitam o ambiente tem à disposição sushis vendidos aos pares, como o de camurim (R$ 13,00) e o bajiro, de barriga de salmão gordo, flor de sal e manjericão (R$ 15,95). Nenhum pescado, porém, é páreo para o atum, entregue marinado e selado em óleo de gergelim com redução de shoyu, shissô desidratado e finas fatias de limão (R$ 47,00) e também em outros preparos que nem sempre figuram no cardápio. A cozinha quente exibe igual apuro, sobretudo em receitas clássicas como o yakisoba à moda de nagasaki, em que a massa frita é envolvida por molho de legumes e frutos do mar (R$ 66,00). No almoço durante a semana, a casa oferece menu executivo, composto de entrada, prato e sobremesa por R$ 41,90. Somente à noite são servidos os pastéis que remetem à origem gastronômica do clã - o de carne é vendido por R$ 8,00. Os preços e demais informações foram apurados entre os meses de abril e junho de 2015. Comer & Beber Vencedor Categoria(s): JAPONESES",11h30/15h e 18h/23h30 (sex. jantar até 0h, sáb. almoço até 15h30 e jantar até 0h, fecha dom.),"Acima de R$ 100,00",American Express,Dinners,Mastercard,Visa,Maestro,Rede Shop,Visa Electron,Acesso wireless,Ar condicionado,Levar vinhos (permite),-80392893,-349033923,,Lugares/Capacidade (total 113),Valet/Manobrista,Vinho em taça,,,,,,,,,,,,,,,,,,,,1.57,178,,
0,It,Restaurantes,Variados,PE,"Rua Professor Eduardo Wanderley Filho, 187",Boa Viagem,Recife,3031-6288,"Na mesa comunitária, a clientela moderninha começa pelo carpaccio de haddock defumado com vinagrete de trufas brancas (R$ 25,00, para duas pessoas), entre goles de clericot (R$ 70,00 a jarra com 600 mililitros). O medalhão de filé-mignon ao molho de mostarda de Dijon é guarnecido de risoto de parmesão (R$ 38,90). Para o salmão grelhado, o acompanhamento é risoto de quinoa com aspargos (R$ 42,90). Cabe à torta de chocolate com amêndoas e nozes (R$ 18,00) encerrar a refeição. Os preços e demais informações foram apurados entre os meses de abril e junho de 2015.",12h/19h (sáb. até 16h, fecha dom.),"Até R$ 50,00",Dinners,Mastercard,Visa,,Maestro,Rede Shop,Visa Electron,Acesso wireless,Ar condicionado,Estacionamento,-81112994,-348943798,,Levar vinhos (permite),Lugares/Capacidade (total 55),Valet/Manobrista,,,Vinho em taça,,,,,,,,,,,,,,,,,3.22,207,,,
0,Caponata Cucina Italiana,Restaurantes,Italianos,PE,"Avenida Governador Agamenon Magalhães, 153, Shopping Tacaruna",Santo Amaro,Recife,3412-6000,"Entre luminárias produzidas com garrafas de vinho, os clientes começam a refeição pelo antepasto, que mescla azeitona, caponata e tiras crocantes de massa de pizza (R$ 13,90, para duas pessoas). O medalhão ao vinho com risoto de parmesão (R$ 37,60) compete com o nhoque de batata e ervas sob ragu de linguiça (R$ 27,50). Na adega, repousam vinhos como o argentino Vista Calma Malbec (R$ 50,00). Para a sobremesa, tem petit gâteau com sorvete de creme (R$ 13,90). Os preços e demais informações foram apurados entre os meses de abril e junho de 2015.",9h/22h (dom. 12h/20h),"R$ 51,00 a R$ 75,00",Dinners,Hipercard,Mastercard,Visa,Maestro,Rede Shop,Visa Electron,Acesso para deficientes,Ar condicionado,Estacionamento,-80392936,-348730955,,Lugares/Capacidade (total 75),Vinho em taça,,,,,,,,,,,,,,,,,,,,,1.36,248,,,,
0,Ilha Sertaneja,Restaurantes,Cozinha regional,PE,"Rua Doutor Nylo Dornelas Câmara, 16",Boa Viagem,Recife,3048-5886,"O bufê foca nas receitas típicas do sertão: sarapatel, buchada e galinha ou bode guisados passam pela balança (R$ 60,00 o quilo de segunda a sexta, R$ 64,90 nos fins de semana). À la carte, a porção de pastel de camarão, requeijão e parmesão (R$ 17,90) é boa companhia para a caipirinha de cajá (R$ 15,90). Para dividir, a carne de sol com queijo de coalho vai à mesa com arroz, feijão-verde, farofa de jerimum e vinagrete (R$ 99,90). Os preços e demais informações foram apurados entre os meses de abril e junho de 2015.",11h30/1h30 (sáb. e dom. até 2h),"R$ 51,00 a R$ 75,00",Mastercard,Visa,,,Maestro,Rede Shop,Visa Electron,Acesso para deficientes,Acesso wireless,Ar condicionado,-81311158,-349017603,,Estacionamento,Lugares/Capacidade (total 184),Vinho em taça,,,,,,,,,,,,,,,,,,,,4.27,127,,,,
0,Restaurante da Mira,Restaurantes,Cozinha regional,PE,"Avenida Doutor Eurico Chaves, 916",Casa Amarela,Recife,(81) 3268-6241,"Aldemira Pereira Lima, a dona Mira, comanda as panelas enquanto o filho, Edmilson, apresenta o cardápio de forma divertida. Oferecido como cortesia, o caldo de feijão mulatinho faz parceria com a caipirinha (R$ 5,00). Depois vêm à mesa o bode assado, a galinha à cabidela ou o sarapatel, todos servidos com arroz e feijão preto (ou pirão) - os pratos custam R$ 60,00 cada um e alimentam duas pessoas. Os preços e demais informações foram apurados entre os meses de abril e junho de 2015.",12h/18h (fecha seg. e ter.),"Até R$ 50,00",,,,,,,,Lugares/Capacidade (total 80),,,-80209351,-349265694,,,,,,,,,,,,,,,,,,,,,,,,3.74,300,,,,
0,La Tratoria,Restaurantes,Italianos,PE,"Rua dos Navegantes, 81",Porto de Galinhas,Ipojuca,(81) 9654-5778,"O espírito cantineiro da decoração se repete no cardápio. O filé alto firenze, ao molho de espinafre gratinado com parmesão, sai da cozinha acompanhado de fettuccine (R$ 38,90). Diante da jarra de sangria (R$ 25,50, 1 litro), tem papel de antepasto a ricota temperada, gratinada com mix de queijos e molho de tomate (R$ 19,50, para duas pessoas). Servido quente, o bolo de frutas douradas, sob coulis de frutas vermelhas ao licor de cassis, traz uma bola de sorvete de creme (R$ 15,90, para dois). Os preços e demais informações foram apurados entre os meses de abril e junho de 2015.",18h/0h,"R$ 51,00 a R$ 75,00",Dinners,Mastercard,,,Visa Electron,,,Ar condicionado,Levar vinhos (permite),Lugares/Capacidade (total 40),-85055157,-350034446,,Vinho em taça,,,,,,,,,,,,,,,,,,,,,,3.11,163,,,,
0,Casa de Noca,Restaurantes,Cozinha regional,PE,"Rua Bertioga, 243",Carmo,Olinda,(81) 3439-1040,"A tradição de servir um prato único é mantida há 35 anos por Noêmia Batista, a Noca. O público que visita o Centro Histórico de Olinda faz fila para comer a carne de sol acompanhada de macaxeira cozida e queijo de coalho. As porções têm a medida para duas pessoas (R$ 60,00), três (R$ 80,00) ou cinco (R$ 100,00). A cerveja Original (R$ 10,00) toma conta dos copos. Para adoçar, são duas as opções: queijo de coalho com mel de engenho (R$ 12,00) e pudim de leite (R$ 6,00). Os preços e demais informações foram apurados entre os meses de abril e junho de 2015.",11h/23h,"Até R$ 50,00",American Express,Dinners,Mastercard,Visa,Maestro,Rede Shop,Visa Electron,Acesso wireless,Lugares/Capacidade (total 150),,-80135047,-348524888,,,,,,,,,,,,,,,,,,,,,,,,3.76,83,,,,
0,Casato Bistrô,Restaurantes,Variados,PE,"Avenida Rui Barbosa, 1105",Graças,Recife,3089-4267,"Em março, o Bazza mudou de nome e alterou o menu. Assinado pela chef Marina Drahomiro, o ceviche de camarão com chips de banana frita (R$ 28,95) antecede o carré de cordeiro ao molho de vinho, guarnecido de purê de macaxeira e vegetais grelhados (R$ 43,25). Da carta de cervejas especiais faz parte a alemã Benediktiner Weissbier (R$ 19,90, 500 mililitros), boa companhia para a linguiça com cebola confitada, molho de mostarda e torradas (R$ 25,95). A cheesecake de doce de leite e banana caramelada soma R$ 12,25 à conta. Os preços e demais informações foram apurados entre os meses de abril e junho de 2015.",12h/23h (sex. e sáb. até 0h, dom. até 16h),"R$ 51,00 a R$ 75,00",Dinners,Hipercard,Mastercard,Visa,Maestro,Visa Electron,,Acesso para deficientes,Acesso wireless,Ar condicionado,-80434157,-349045787,,Atividades para crianças,Estacionamento,Levar vinhos (permite),,,Lugares/Capacidade (total 42),,Vinho em taça,,,,,,,,,,,,,,,4.15,15,,,
0,Casa da Picanha,Restaurantes,Cozinha regional,PE,"Rua Santos Leite, 88",Pina,Recife,(81) 3466-8336 e 3034-7153,"Um dos atrativos da casa, o farto mistão (R$ 92,90, para seis pessoas) mistura, sobre uma chapa, picanha, maminha, carne de sol e linguiças calabresa, toscana e de bode, tudo assado na brasa - feijão-tropeiro, arroz, farofa de ovos, vinagrete e batata frita escoltam a porção. As mesmas guarnições acompanham a picanha argentina na chapa (R$ 84,90, para duas pessoas). Hit do menu de petiscos, o sarapatel de porco com farinha (R$ 19,90) pode fazer par com uma caipirinha (R$ 7,90). Os preços e demais informações foram apurados entre os meses de abril e junho de 2015.",11h/0h,"Até R$ 50,00",American Express,Dinners,Mastercard,Visa,Maestro,Rede Shop,Visa Electron,Acesso para deficientes,Acesso wireless,Estacionamento,-80880866,-348887323,,Lugares/Capacidade (total 250),Vinho em taça,,,,,,,,,,,,,,,,,,,,,2.17,93,,,,
0,Kovacic: A Arte de Cozinhar,Restaurantes,Cozinha contemporânea,PE,"Rua Dom Pedro Henrique, 153A",Santo Amaro,Recife,99612-7776,"À noite, o bistrô do chef Cláudio Kovacic só funciona de quinta e sábado, e exclusivamente mediante reserva. O menu-degustação com sete etapas sai por R$ 89,75. Em mudança recente, passou a abrir também para almoço, de terça a sábado - entrada, prato principal e sobremesa custam R$ 35,00. A combinação pode ser pastel de rabada ao vinho tinto com pimenta de tamarindo; atum malpassado em manteiga de alho defumado, acompanhado de nhoque de macaxeira; e bombom de chocolate recheado com cranberry ao rum. Na carta de vinhos, o chileno Casillero del Diablo Malbec vale R$ 75,00. Os preços e demais informações foram apurados entre os meses de abril e junho de 2015.",12h/15h (qui. a sáb. também 20h30/0h, fecha dom. e seg.),"R$ 76,00 a R$ 100,00",,,,,,,,Acesso para deficientes,Levar vinhos (permite),Lugares/Capacidade (total 29),-80524611,-348896907,,Vinho em taça,,,,,,,,,,,,,,,,,,,,,,4.42,207,,,
0,Casbah,Restaurantes,Variados,PE,"Rua 27 de Janeiro, 7",Carmo,Olinda,98513-3525 e 3429-1390,"Uma autêntica casa árabe do século XVII abriga o restaurante. A entrada arabidinho (R$ 24,00), que reúne homus, frango ao curry, babaganuche, salada e pão de grão-de-bico, antecede o cuscuz marroquino de cordeiro (R$ 39,00). O guisado verde (R$ 39,90), composto de cordeiro ao curry com purê de batata-doce e arroz integral, pode ser escoltado pelo tinto italiano Nero D'Avola (R$ 60,00). Por R$ 10,00, um doce de mangaba finaliza a refeição. Os preços e demais informações foram apurados entre os meses de abril e junho de 2015.",19h/0h (dom. 16h/22h, fecha seg. e ter.),"R$ 51,00 a R$ 75,00",Mastercard,Visa,,,Maestro,Rede Shop,Visa Electron,Acesso wireless,Levar vinhos (permite),Lugares/Capacidade (total 80),-80166739,-348529764,,Vinho em taça,,,,,,,,,,,,,,,,,,,,,,3.88,28,,,
0,Restaurante do Geraldo,Restaurantes,Cozinha regional,PE,"Rua da Piedade, 107",Santo Amaro,Recife,3231-4177,"O proprietário Geraldo Lima atrai a clientela com receitas como galinha à cabidela, acompanhada de fava, arroz e farofa. O prato sai por R$ 25,00, mesm preço cobrado pelo chambaril com pirão, arroz e legumes. Tira-gostos para dividir, a exemplo do sarapatel com farinha branca e da bisteca suína com batata frita (R$ 20,00 cada um), vão bem com a cerveja Original (R$ 9,80). Batizada de banana rica, a sobremesa leva a fruta em calda, creme de pavê e suspiro (R$ 9,00). Os preços e demais informações foram apurados entre os meses de abril e junho de 2015.",11h/17h (fecha dom.),"Até R$ 50,00",American Express,Dinners,Hipercard,Mastercard,Maestro,Rede Shop,Visa Electron,Ar condicionado,Lugares/Capacidade (total 64),,-80545071,-348797664,Visa,,,,,,,,,,,,,,,,,,,,,,,4.74,236,,,,
0,O Pátio Café & Cozinha,Restaurantes,Variados,PE,"Avenida Rui Barbosa, 141",Graças,Recife,(81) 3034-3534 e 99771-1615,"Os frequentadores do antigo casarão escolhem entre quatro ambientes: dois salões climatizados, varanda e jardim com chafariz. Faz sucesso a carne de sol à moda do pátio, grelhada na manteiga de garrafa, com queijo de coalho, risoto, feijão-verde e macaxeira frita (R$ 47,90). Novo no menu, o risoto cava del mare leva camarão, polvo, lula e mexilhão salteados na manteiga de açafrão (R$ 45,90). O vinho branco chileno Cousiño-Macul Don Luis (R$ 54,90) escolta o pedido. Às quartas, tem chá da tarde com quitutes como bolo de rolo e pastel de festa, suco, café e chá (R$ 32,90 por pessoa). Os preços e demais informações foram apurados entre os meses de abril e junho de 2015.",12h/21h (sex. até 1h, dom. até 17h, fecha sáb.),"R$ 51,00 a R$ 75,00",American Express,Hipercard,Mastercard,Visa,Maestro,Visa Electron,,Acesso para deficientes,Acesso wireless,Ar condicionado,-80506311,-3490001,,Atividades para crianças,Estacionamento,Levar vinhos (permite),,,Lugares/Capacidade (total 150),,Valet/Manobrista,,,,,,Valetinho em taça,,,,,,,,,1.82,146,,
0,Mingus,Restaurantes,Variados,PE,"Rua Atlântico, 102",Boa Viagem,Recife,(81) 3465-4000,"Recém-reformada, a casa embala as noites de quinta a sábado com blues, jazz e MPB ao vivo. Robatas de camarão (R$ 44,00, doze unidades) distraem a clientela antes da chegada do tagliatelle com aspargos e presunto cru (R$ 48,00). O tinto chileno Casa Silva Reserva Carménère (R$ 116,00) acompanha a coxa de pato confit com ragu de lentilhas (R$ 58,00). Para encerrar, a escolha recai sobre o suspiro com morangos e creme inglês (R$ 26,00). Três etapas compõem o menu de almoço executivo, servido de terça a sexta por R$ 36,00. Faz a vez de prato principal a tilápia empanada em farinha panko mais risoto de açafrão e tomate concassé. Os preços e demais informações foram apurados entre os meses de abril e junho de 2015.",12h/16h e 19h30/0h (sáb. jantar 20h/1h, dom. só almoço, fecha seg.),"R$ 76,00 a R$ 100,00",American Express,Dinners,Mastercard,Visa,Maestro,Rede Shop,Visa Electron,Acesso para deficientes,Acesso wireless,Ar condicionado,-80977813,-348867624,,Estacionamento,Levar vinhos (permite),Lugares/Capacidade (total 100),,,Valet/Manobrista,,Vinho em taça,,,,,,,,,,,,,,,4.44,64,,
0,Villa Foria,Restaurantes,Pizzarias,PE,"Rua das Graças, 239",Graças,Recife,3204-7154,"Eis uma pizza para quem gosta de botar a mão na massa. Bicampeã da categoria, a Villa Foria investe em uma massa de espessura fininha, bem crocante, que dispensa o uso de talheres - quem não quer sujar os dedos usa providenciais luvinhas de plástico, disponíveis aos montes nas mesas. Esse formato se mostra mais que acertado: até 3 000 discos são assados em um único mês pelo time de quatro pizzaiolos, e uma segunda unidade da marca deve ser aberta ainda no mês de julho, em Boa Viagem. O cardápio propõe 36 coberturas, da clássica marguerita (R$ 45,90 a de 38 centímetros) a combinações surpreendentes, como a de salame espanhol com queijo do reino ou a de damasco mais queijo brie (R$ 55,90 cada uma). Todas têm por base molho de tomate e mussarela, incluída aí a de pepperoni, coroada por um aromático pesto feito de manjericão, castanha-do-pará, parmesão e azeite (R$ 52,90). A versão de morango e Nutella (R$ 32,90), por sua vez, recebe uma fina camada de catupiry para abrandar o excesso de doçura. Instalada em um casarão restaurado, quase em frente à Paróquia Nossa Senhora das Graças, a pizzaria acomoda os clientes no salão, pontuado por grandes portas e janelas de madeira rústica, ou na aprazível varanda. Ali, é costume distrair o paladar com entradinhas, entre as quais as trouxinhas de massa crocante recheadas de carne de sol, que vêm acompanhadas de mel de engenho (R$ 25,90, seis unidades). Os preços e demais informações foram apurados entre os meses de abril e junho de 2015. Comer & Beber Vencedor Categoria(s): PIZZARIAS",18h/0h (dom. a partir das 17h30),"R$ 51,00 a R$ 75,00",American Express,Dinners,Hipercard,Mastercard,Maestro,Rede Shop,Visa Electron,Acesso para deficientes,Ar condicionado,Atividades para crianças,-80486167,-349037027,Visa,Levar vinhos (permite),Lugares/Capacidade (total 140),Valet/Manobrista,,,Vinho em taça,,,,,,,,,,,,,,,,,2.37,25,,,,
0,Bode do Nô,Restaurantes,Cozinha regional,PE,"Avenida São Miguel, 1401",Afogados,Recife,(81) 3428-8889,"Com quatro unidades na Grande Recife, a rede é comandado pela família de Evangelista Severino de Lima, o Nô. A linguiça de bode (R$ 6,90 a unidade) alivia a espera pela especialidade da casa: super bode guisado com feijão verde, pirão de queijo, cuscuz, macaxeira frita, paçoca de bode e vinagrete (R$ 55,90, para quatro pessoas). O carré de bode assado no vinho, com arroz e batata sautée (R$ 73,90, para quatro pessoas), vai bem com a cachaça alagoana Gogó da Ema (R$ 8,00 a dose). Os preços e demais informações foram apurados entre os meses de abril e junho de 2015.",11h/1h,"Até R$ 50,00",American Express,Dinners,Mastercard,Visa,Rede Shop,Visa Electron,,Acesso para deficientes,Acesso wireless,Ar condicionado,-80810869,-349215325,,Atividades para crianças,Levar vinhos (permite),Lugares/Capacidade (total 400),,,Vinho em taça,,,,,,,,,,,,,,,,,4.57,288,,,,
0,Armazém Central,Restaurantes,Variados,PE,"Avenida General Barreto de Menezes, 800 - Shopping Guararapes",Piedade,Jaboatão dos Guararapes,3305-7303,"Folhetos da literatura de cordel e azulejos pintados pelo recifense José Ferreira decoram o salão, onde o chef Arthur Mendes serve receitas como o bacalhau do azevedo - o lombo grelhado com cebola, alcaparra, azeitona preta e pimenta de cheiro vai ao prato com creme de espinafre e arroz de alho-poró (R$ 29,90). Entre as dezessete variedades de pizzas salgadas e doces, faz sucesso a de frango desfiado com cheddar (R$ 19,90, seis fatias). Do rol de petiscos, os cubos de picanha com creme de alho e batata frita (R$ 29,90) vão bem com a caipirosca de limão feita com Smirnoff (R$ 11,90). Os preços e demais informações foram apurados entre os meses de abril e junho de 2015.",9h/22h,"R$ 51,00 a R$ 75,00",American Express,Dinners,Hipercard,Mastercard,Maestro,Rede Shop,Visa Electron,Acesso para deficientes,Acesso wireless,Ar condicionado,-81671048,-349203916,Visa,Estacionamento,Lugares/Capacidade (total 130 lugares),,,,,,,,,,,,,,,,,,,,,4.99,236,,,,
0,Ilha Sushi,Restaurantes,Japoneses,PE,"Rua Maria Carolina, 80",Boa Viagem,Recife,(81) 3466-2122,"Antes de chegar aos pratos quentes, entre os quais faz sucesso o teppan yaki de filé-mignon acompanhado de legumes e gohan (R$ 55,00, para duas pessoas), a clientela abre o apetite com o sunomono de salmão (R$ 38,00) e a porção de guioza de camarão (R$ 32,00, seis unidades). A saquerinha de cajá (R$ 12,00) é preparada com saquê Jun Daiti. Na sobremesa à brasileira, a cartola dá para duas pessoas (R$ 21,00). Os preços e demais informações foram apurados entre os meses de abril e junho de 2015.",11h/2h (sex. e sáb. até 4h),"R$ 51,00 a R$ 75,00",American Express,Dinners,Hipercard,Mastercard,Maestro,Rede Shop,Visa Electron,Acesso para deficientes,Acesso wireless,Ar condicionado,-81154847,-348961493,Visa,Estacionamento,Lugares/Capacidade (total 150),Valet/Manobrista,,,,,,,,,,,,,,,,,,,,1.23,272,,,,
0,Beijupirá,Restaurantes,Peixes e frutos do mar,PE,"Rua Saldanha Marinho, s/nº - Alto da Sé",Carmo,Olinda,3439-6691,"A rede que pertence à chef Adriana Didier ganhou nova unidade no Empório Gourmet Reserva do Paiva, onde são servidos pratos exclusivos. Entre eles estão os croquetes de espinafre ao molho de pitanga (R$ 24,00, seis unidades) e o farfalle ao limão com camarões graúdos flambados (R$ 66,80). Nos outros endereços, as trouxinhas de aratu, cheddar e camarão, ao molho de maracujá (R$ 27,00, oito unidades), abrem caminho para o beijumanga (R$ 58,60), filé de peixe grelhado com gergelim, acompanhado de arroz de coco. Para adoçar, o hit é o alçuba (R$ 20,50), crepe de fios de ovos com sorvete de tapioca, calda de mel de engenho defumada na cachaça e farofa de castanha-de-caju. Os preços e demais informações foram apurados entre os meses de abril e junho de 2015.",12h/1h (qua. e qui. a partir das 17h, fecha ter.),"R$ 76,00 a R$ 100,00",American Express,Dinners,Mastercard,Visa,Maestro,Rede Shop,Visa Electron,Acesso para deficientes,Acesso wireless,Ar condicionado,-80122382,-348553059,,Levar vinhos (permite),Lugares/Capacidade (total 100),Valet/Manobrista,,,Vinho em taça,,,,,,,,,,,,,,,,,1.89,202,,,
0,Feijoada do Vavá,Restaurantes,Brasileiros,PE,"Avenida Jean Emile Favre, 757",Ipsep,Recife,(81) 3339-2413,"Afora a feijoada, acompanhada de porções de arroz, vinagrete, farofa, couve e fatias de laranja ou abacaxi (R$ 46,50, para duas pessoas), a cozinha prepara pratos de acento regional. Entre os mais requisitados estão a picanha argentina na chapa, servida com feijão-verde, arroz, vinagrete, farofa amarela e purê (R$ 77,60), e o charque na brasa, com guarnições praticamente idênticas, exceto pela farofa, que é de jerimum (R$ 49,50). Ambos servem duas pessoas. Para a sobremesa tem torta alemã (R$ 9,90) e pavê de Sonho de Valsa (R$ 6,90). Os preços e demais informações foram apurados entre os meses de abril e junho de 2015.",11h/16h,"Até R$ 50,00",American Express,Dinners,Hipercard,Mastercard,Maestro,Rede Shop,Visa Electron,Acesso wireless,Estacionamento,Lugares/Capacidade (total 200),-8109015,-349192642,Visa,,,,,,,,,,,,,,,,,,,,,,,2.34,24,,,,
0,Antiquário,Restaurantes,Portugueses,PE,"Rua do Cupim, 250",Graças,Recife,(81) 3244-0152,"Entre fotos antigas do Recife, os clientes devoram o bacalhau à espanhola, grelhado no azeite com alho e cebola, que vai à mesa com batata cozida, pimentões coloridos e azeitona preta (R$ 79,00, para duas pessoas). No rol das carnes, o filé-mignon aderaldo trigueiro, dourado no azeite com alho, recebe legumes ao molho madeira e batata palha como guarnições (R$ 44,90, para duas pessoas). O tinto alentejano Esporão Monte Velho (R$ 66,00) escolta os pedidos. Os preços e demais informações foram apurados entre os meses de abril e junho de 2015.",11h30/0h (sex. e sáb. até 2h, dom. até 19h),"Até R$ 50,00",American Express,Dinners,Hipercard,Mastercard,Maestro,Rede Shop,Visa Electron,Acesso para deficientes,Acesso wireless,Ar condicionado,-80456835,-348997976,Visa,Atividades para crianças,Levar vinhos (permite),Lugares/Capacidade (total 200),,,Valet/Manobrista,,Vinho em taça,,,,,,,,,,,,,,,1.91,56,,,
0,Porto Barracuda,Restaurantes,Peixes e frutos do mar,PE,"Avenida Beira Mar, 172 - Vila de Todos os Santos",Praia de Maracaípe,Ipojuca,99797-2404,"Nas mesas ao ar livre, iscas empanadas de pescada amarela ao molho rosé (R$ 40,00) ajudam a distrair até a chegada do camarão à thermidor com arroz de brócolis e batata corada (R$ 98,00, para dois). O prosecco Don Guerino (R$ 70,00) é acionado para o brinde. Na sobremesa, a cartola barracuda (R$ 35,00, para dois) leva banana flambada no conhaque, queijo de coalho gratinado com raspas de chocolate e sorvete de creme com calda de morango. Os preços e demais informações foram apurados entre os meses de abril e junho de 2015.",10h/17h,"R$ 51,00 a R$ 75,00",American Express,Dinners,Mastercard,Visa,Maestro,Rede Shop,Visa Electron,Acesso wireless,Estacionamento,Lugares/Capacidade (total 100),-8529564,-35007638,,,,,,,,,,,,,,,,,,,,,,,,2.29,100,,,,
0,Tay San,Restaurantes,Chineses,PE,"Rua Francisco da Cunha, 47",Boa Viagem,Recife,(81) 3466-4488,"O rolinho com charque e catupiry (R$ 6,60) engana a fome antes da chegada do macarrão frito especial, com carne bovina, frango, camarão, chuchu, cenoura, acelga e pimentão (R$ 48,00, para duas pessoas). Quem opta pelo rodízio japonês, disponível de segunda a sexta no jantar, paga R$ 41,90 para ter acesso ao bufê de sushis e frituras - o preço também dá direito a dois temakis, cinco sashimis, um sunomono e cinco sushis especiais. Os preços e demais informações foram apurados entre os meses de abril e junho de 2015.",11h/15h e 18h/23h (dom. sem intervalo até 22h30),"Até R$ 50,00",American Express,Dinners,Hipercard,Mastercard,Maestro,Rede Shop,Visa Electron,Acesso para deficientes,Acesso wireless,Ar condicionado,-81139687,-348980067,Visa,Estacionamento,Lugares/Capacidade (total 240),Valet/Manobrista,,,,,,,,,,,,,,,,,,,,1.63,120,,,,
